{
  "schema_version": "1.0",
  "batch_id": "ai_batch_2026_06_09_001",
  "workspace": "clariobase",
  "purpose": "lead_review",
  "created_at": "2026-06-09T12:00:00+02:00",
  "instructions": {
    "goal": "Choose the best leads for mini-audit preparation and recommend the next action.",
    "business_context": "ClarioBase sells structured online presence, websites, measurement and practical improvements for local beauty businesses in Upper Silesia.",
    "allowed_decisions": [
      "prepare_mini_audit",
      "contact_now",
      "nurture",
      "reject",
      "needs_manual_review"
    ]
  },
  "leads": [
    {
      "lead_id": "LEAD-000001",
      "customer_id": "CLB-000001",
      "business_name": "Example Beauty Studio",
      "city": "Chorzow",
      "category": "beauty salon",
      "website_url": "https://example-beauty.invalid",
      "instagram_url": "https://instagram.com/example_beauty",
      "google_rating": 4.8,
      "google_reviews_count": 82,
      "score_total": 76,
      "score_reasons": [
        "Active Instagram profile",
        "Website has weak call to action",
        "Many Google reviews"
      ],
      "current_status": "Qualified",
      "last_activity": null,
      "notes": "Anonymized sample record. Not a real lead."
    }
  ]
}
